subreddit,permalink,score,num_comments,title,body_text,image_url
IndiaCricket,https://old.reddit.com/r/IndiaCricket/comments/1driig5/a_scene_for_ages_an_absolute_cinema_of_a_world_cup/,20055,423,"A scene for ages, an absolute cinema of a World Cup!",,
IndiaCricket,https://old.reddit.com/r/IndiaCricket/comments/17z0agk/it_hurts/,10841,779,It hurts,,https://i.redd.it/8vtgaqp5vb1c1.png
IndiaCricket,https://old.reddit.com/r/IndiaCricket/comments/1la8awz/indian_cricket_looks_so_commercializedfelt_the_og/,9237,198,"indian cricket looks so commercialized,felt the OG cricket vibes in AUS vs SA",,https://i.redd.it/w31z5rs6um6f1.png
IndiaCricket,https://old.reddit.com/r/IndiaCricket/comments/1e0241o/for_those_who_think_cricket_fans_are_uneducated/,9096,607,For those who think cricket fans are uneducated and unemployed. Dutch fams attacking a pub full of English fans.,,
IndiaCricket,https://old.reddit.com/r/IndiaCricket/comments/1j7b2ur/india_are_champions_india_beats_new_zealand_in/,8774,801,INDIA ARE CHAMPIONS! India Beats New Zealand in the 2025 CT Final!,,https://i.redd.it/2namhgmzvone1.jpeg
IndiaCricket,https://old.reddit.com/r/IndiaCricket/comments/1nsvv1l/the_winning_moment/,8645,332,The winning moment.......,,
IndiaCricket,https://old.reddit.com/r/IndiaCricket/comments/1klfzts/the_last_one_player_of_our_generation_who_got_a/,8169,134,"The last one player of our generation who got a proper farewell ""Aashish Nehra""",,
IndiaCricket,https://old.reddit.com/r/IndiaCricket/comments/1ho3xx8/ravi_shastri_was_in_tears_during_commentary_as/,8078,176,Ravi Shastri was in tears during commentary as Reddy completed his maiden international hundred,,
IndiaCricket,https://old.reddit.com/r/IndiaCricket/comments/17ob4zt/the_moment_virat_kohli_completed_49th_hundred_in/,7709,119,The moment Virat Kohli completed 49th hundred in ODI,,
IndiaCricket,https://old.reddit.com/r/IndiaCricket/comments/164fzxk/and_they_want_to_make_hardik_pandya_captain/,7537,145,And they want to make Hardik Pandya captain instead of Bumrah. Why? What a wonderful man Rinku Singh & captain Bumrah.,,
IndiaCricket,https://old.reddit.com/r/IndiaCricket/comments/1mzn7if/hello_reddit_im_sachin_tendulkar_here_for_an_ama/,7325,4979,Hello Reddit! I’m Sachin Tendulkar. Here for an AMA on r/IndiaCricket - Ask Me Anything!,"https://preview.redd.it/vh4nq8vgb5lf1.jpg?width=3024&format=pjpg&auto=webp&s=a1cb401398b08f2368d21092643d92bfa2a66d29
I played cricket for India from 1989 to 2013. India and Cricket gave me everything, now giving back through the Sachin Tendulkar Foundation. Here to answer your questions. AMA! I will be answering your questions at 5 PM IST today.
Thanks to the moderators of
r/IndiaCricket
for a well-organised AMA.
The questions were amazing, I really enjoyed interacting with all of you here. I will keep engaging and sharing on Reddit. See you soon.",
IndiaCricket,https://old.reddit.com/r/IndiaCricket/comments/1hgzsnr/dressing_room_bts_r_ashwins_parting_words_to_team/,7156,240,Dressing Room BTS | R Ashwin's parting words to Team India,,
IndiaCricket,https://old.reddit.com/r/IndiaCricket/comments/17x7yen/that_moment_when_you_finally_get_over_the_past/,7055,181,That moment when you finally get over the past,,https://i.redd.it/kqa9pslcgu0c1.png
IndiaCricket,https://old.reddit.com/r/IndiaCricket/comments/1ag71tn/braveheart_anil/,7001,188,Braveheart Anil,,
IndiaCricket,https://old.reddit.com/r/IndiaCricket/comments/1l2kzeq/finally_a_real_image_with_the_trophy/,6816,156,Finally a Real image with the trophy !!!,,https://i.redd.it/tn6ld94vkr4f1.png
IndiaCricket,https://old.reddit.com/r/IndiaCricket/comments/13x7h83/ms_dhoni_a_tactical_mastermind/,6749,105,MS Dhoni - A tactical mastermind!,,
IndiaCricket,https://old.reddit.com/r/IndiaCricket/comments/1ok5vyh/the_iconic_stains_on_the_jersey_of_indian_no_3_in/,6654,152,The iconic stains on the jersey of Indian no. 3 in an iconic knockout in Mumbai.,,https://i.redd.it/flemxgav9ayf1.jpeg
IndiaCricket,https://old.reddit.com/r/IndiaCricket/comments/1992vb8/india_defeats_afghanistan_in_the_second_super/,6650,212,"India defeats Afghanistan in the second super over, Ravi Bishnoi is the man",,
IndiaCricket,https://old.reddit.com/r/IndiaCricket/comments/1li9l5c/this_is_so_jarring_to_even_look_at/,6621,281,This is so Jarring to even look at,How long will Bumrah support us without any support himself ? I really don’t see any future to Indian bowling,https://i.redd.it/ujemvammgm8f1.jpeg
IndiaCricket,https://old.reddit.com/r/IndiaCricket/comments/179qp27/circle_of_life/,6539,147,Circle of life,,
IndiaCricket,https://old.reddit.com/r/IndiaCricket/comments/16j4tg4/ms_dhoni_giving_a_lift_to_a_young_cricketer_on/,6434,303,MS Dhoni giving a lift to a young cricketer on his bike.,,
IndiaCricket,https://old.reddit.com/r/IndiaCricket/comments/17snew7/autograph_on_car_for_a_fan/,6417,142,Autograph on car for a fan,,
IndiaCricket,https://old.reddit.com/r/IndiaCricket/comments/1nt0jv5/india_celebrates_the_win_without_the_actual/,6334,139,India celebrates the win without the actual trophy by lifting an imaginary cup.,,
IndiaCricket,https://old.reddit.com/r/IndiaCricket/comments/17ih3om/virender_sehwag_the_legend/,6336,122,Virender Sehwag the legend,,
IndiaCricket,https://old.reddit.com/r/IndiaCricket/comments/1duwnx5/surya_kumar_yadav_dancing_in_delhi/,6322,120,Surya Kumar Yadav dancing in Delhi,,
IndiaCricket,https://old.reddit.com/r/IndiaCricket/comments/1jjdojs/its_a_serious_matter_and_it_should_be_addressed/,6325,420,It's a serious matter and it should be addressed:,,
IndiaCricket,https://old.reddit.com/r/IndiaCricket/comments/1lg8ulf/shubman_gill_brings_an_illustratrious_hundred_as/,6265,350,Shubman Gill brings an Illustratrious Hundred as the new Indian test captain,,
IndiaCricket,https://old.reddit.com/r/IndiaCricket/comments/1gihnui/new_zealand_whitewash_india_in_india/,6241,806,New Zealand whitewash India in India,,https://i.redd.it/g7r1or1h3nyd1.png
IndiaCricket,https://old.reddit.com/r/IndiaCricket/comments/1l2zan6/virat_kohli_with_former_indian_coach_ravi_shastri/,6220,93,Virat Kohli with former Indian Coach Ravi Shastri after winning IPL,What a coach-captain relationship they both share!!! Virat Kohli peaked under the leadership of Ravi Shastri and gave us so many innumerable knocks and moments.,
IndiaCricket,https://old.reddit.com/r/IndiaCricket/comments/1dcc8ql/ravi_shastri_presented_the_best_fielder_medal/,6214,228,Ravi Shastri presented the best fielder medal after India vs Pakistan game,,
IndiaCricket,https://old.reddit.com/r/IndiaCricket/comments/17v2e3l/indian_cricket_team_is_an_emotion/,6149,148,Indian Cricket Team is an emotion,,
IndiaCricket,https://old.reddit.com/r/IndiaCricket/comments/1lg5kr4/jaiswal_celebrates_his_first_100_on_english_soil/,6093,218,Jaiswal celebrates his first 100 on english soil.,,
IndiaCricket,https://old.reddit.com/r/IndiaCricket/comments/1l2ja9v/feel_bad_for_him_what_a_player/,6062,201,Feel bad for him. What a player,Warrior fr,https://i.redd.it/9gv2u5kr7r4f1.jpeg
IndiaCricket,https://old.reddit.com/r/IndiaCricket/comments/17jmfd0/i_am_here_to_lift_the_cup/,6053,150,I am here to lift the cup,,
IndiaCricket,https://old.reddit.com/r/IndiaCricket/comments/156bxgd/the_moment_joshua_da_silvas_mother_met_virat/,5940,102,The moment Joshua Da Silva's mother met Virat Kohli. She hugged and kissed Virat and got emotional,,
IndiaCricket,https://old.reddit.com/r/IndiaCricket/comments/1drsdr6/celebrations_from_around_the_world/,5720,207,Celebrations from around the world!,India wins T20 World Cup,
IndiaCricket,https://old.reddit.com/r/IndiaCricket/comments/1drhffp/virat_kohli_announces_his_t20i_retirement/,5724,285,Virat Kohli announces his T20I retirement.,,https://i.redd.it/ulielkntyj9d1.jpeg
IndiaCricket,https://old.reddit.com/r/IndiaCricket/comments/17c2fuc/kl_rahul_gives_the_best_fielder_medal_to_ravindra/,5706,107,KL Rahul gives the best fielder medal to Ravindra Jadeja,,
IndiaCricket,https://old.reddit.com/r/IndiaCricket/comments/1kwqs78/spidey_celebrates_in_some_style/,5711,142,Spidey celebrates in some style,"So good to see him back in form, hope he continues it in the England series",
IndiaCricket,https://old.reddit.com/r/IndiaCricket/comments/18261j0/sean_abbott_to_rinku_singh_six_rinku_singh_does/,5697,226,"Sean Abbott to Rinku Singh, SIX! RINKU SINGH DOES IT! This is full and on middle, Singh tonks it high over long on for a biggie. That was so clean. INDIA WIN BY 2 WICKETS.",,
IndiaCricket,https://old.reddit.com/r/IndiaCricket/comments/1hrsfav/australia_pm_literally_behaved_like_a_kohli_fandom/,5660,153,Australia PM literally behaved like a Kohli Fandom,,
IndiaCricket,https://old.reddit.com/r/IndiaCricket/comments/1jl2p78/is_this_the_reason_why_irfan_pathan_was_removed/,5660,295,Is this the reason why Irfan Pathan was removed from the IPL Commentary Team ?,"There were reports that some ""Cricketers"" also complained to BCCI that IP should not be doing commentary cause of his blunt takes and criticism of certain players.",
IndiaCricket,https://old.reddit.com/r/IndiaCricket/comments/1ky39s6/two_years_ago_today_the_greatest_ipl_final_of_all/,5634,136,"Two years ago today, the greatest IPL final of all time began.",🙌🏻Cinema🥶,
IndiaCricket,https://old.reddit.com/r/IndiaCricket/comments/1dqa0hn/rohit_sharma_got_emotional_after_the_semifinals/,5614,247,Rohit Sharma got emotional after the semi-finals win,,
IndiaCricket,https://old.reddit.com/r/IndiaCricket/comments/17m4e4q/virat_kohli_dancing_to_my_name_is_lakkhan/,5554,45,Virat Kohli dancing to 'My Name is Lakkhan',,
IndiaCricket,https://old.reddit.com/r/IndiaCricket/comments/14ofsx3/virat_kohlis_hilarious_mimicry_of_harbhajan_singh/,5540,47,Virat Kohli's hilarious mimicry of Harbhajan Singh,,
IndiaCricket,https://old.reddit.com/r/IndiaCricket/comments/179ycyy/two_most_influential_men_in_indian_cricket/,5480,106,Two most influential men in Indian cricket.,,
IndiaCricket,https://old.reddit.com/r/IndiaCricket/comments/1hy1ykn/a_glimps_of_sachin_tendulkar_was_playing_in/,5397,136,A glimps of Sachin Tendulkar was playing in Domestic Cricket at age of 40.,,
IndiaCricket,https://old.reddit.com/r/IndiaCricket/comments/1661kry/ms_dhoni_stump_mic_collection/,5326,47,MS Dhoni stump mic collection,,
IndiaCricket,https://old.reddit.com/r/IndiaCricket/comments/1ofnkzi/perfect_picture_doesnt_exist/,5300,107,Perfect picture doesn't exist,,https://i.redd.it/9yyu1p62c8xf1.png
IndiaCricket,https://old.reddit.com/r/IndiaCricket/comments/17mm7wd/dressing_room_bts_fielder_of_the_match/,5294,155,Dressing Room BTS - Fielder of the Match,,
IndiaCricket,https://old.reddit.com/r/IndiaCricket/comments/1gymys2/virat_kohli_brings_up_his_81st_century_against/,5288,255,Virat Kohli brings up his 81st century against Australia at Perth,,https://i.redd.it/yad4aooqgt2e1.png
IndiaCricket,https://old.reddit.com/r/IndiaCricket/comments/1bziuni/i_am_not_crying_im_not/,5259,292,I AM NOT CRYING I'M NOT,,
IndiaCricket,https://old.reddit.com/r/IndiaCricket/comments/17whs4n/ms_dhoni_with_fans_in_a_village/,5233,174,MS Dhoni with fans in a village,,
IndiaCricket,https://old.reddit.com/r/IndiaCricket/comments/1dsjnv2/indian_fans_cheering_for_south_africa_after_a/,5204,178,Indian Fans cheering for South Africa after a WorldCup campaign,,
IndiaCricket,https://old.reddit.com/r/IndiaCricket/comments/1aw11dw/sachin_sachin_chant_in_the_flight/,5184,270,‘Sachin Sachin’ Chant in the Flight,,
IndiaCricket,https://old.reddit.com/r/IndiaCricket/comments/17cvn4g/i_think_we_have_glimpsed_the_future/,5122,52,"""I think we have glimpsed the future""",,
IndiaCricket,https://old.reddit.com/r/IndiaCricket/comments/1on04bd/our_girls_with_the_trophy/,5098,69,Our girls with the trophy.,,https://i.redd.it/1bwy2dk7dyyf1.jpeg
IndiaCricket,https://old.reddit.com/r/IndiaCricket/comments/13f5luu/rajasthan_royals_yashasvi_jaiswals_story_from/,5022,134,Rajasthan Royals' Yashasvi Jaiswal's story from living in a tent at Azad Maidan and selling pani puris to scoring an IPL century against Mumbai,,
IndiaCricket,https://old.reddit.com/r/IndiaCricket/comments/1lse5t8/virat_kohli_story_for_shubman/,4979,128,Virat Kohli story for shubman,,https://i.redd.it/cey5sfnw33bf1.jpeg
IndiaCricket,https://old.reddit.com/r/IndiaCricket/comments/176xbxl/this_edit_lives_rent_free/,4919,118,This edit lives rent free,,
IndiaCricket,https://old.reddit.com/r/IndiaCricket/comments/1hg5qly/akash_deep_and_bumrah_saved_india_from_follow_on/,4903,457,Akash Deep and Bumrah saved India from follow on,,https://i.redd.it/1qic4ek96d7e1.png
IndiaCricket,https://old.reddit.com/r/IndiaCricket/comments/1hnwjnm/sunny_g_reaction_on_pants_wkthonest_opinion/,4907,431,"Sunny G reaction On Pants wkt,honest opinion?",,
IndiaCricket,https://old.reddit.com/r/IndiaCricket/comments/1hgzio7/pat_cummins_presented_a_signed_australian_jersey/,4872,97,Pat Cummins presented a signed Australian jersey of all players to Ravi Ashwin and congratulated him.,,https://i.redd.it/dqt65usbdl7e1.jpeg
IndiaCricket,https://old.reddit.com/r/IndiaCricket/comments/1ok6yd6/keep_the_tricolour_flying_high/,4860,217,Keep the tricolour flying high. 💙 🇮🇳,"Fabulous victory! 🇮🇳
Well done Jemimah and Harman for leading from the front. Shree and Deepti, you kept the game alive with the ball.
Keep the tricolour flying high. 💙 🇮🇳",https://i.redd.it/eaymw7kwgayf1.jpeg
IndiaCricket,https://old.reddit.com/r/IndiaCricket/comments/1esqkfh/bcci_will_make_the_nca_available_for/,4868,250,BCCI will make the NCA available for Non-Cricketers as well,,https://i.redd.it/n2eck0yfnsid1.png
IndiaCricket,https://old.reddit.com/r/IndiaCricket/comments/17w1di3/nasser_hussain_is_right_actual_man_who_changed/,4844,294,Nasser Hussain is right. Actual man who changed the culture of this Indian side is Rohit Sharma,,
IndiaCricket,https://old.reddit.com/r/IndiaCricket/comments/1ntdddh/india_missed_an_opportunity_to_do_this_yesterday/,4804,116,India missed an opportunity to do this yesterday.,,
IndiaCricket,https://old.reddit.com/r/IndiaCricket/comments/184bwu0/24_run_over_by_yashasvi_jaiswal/,4786,196,24 run over by Yashasvi Jaiswal,,
IndiaCricket,https://old.reddit.com/r/IndiaCricket/comments/1k3e8hm/the_smile_is_scary_enough_for_a_14_years_old/,4785,101,The Smile is scary enough for a 14 years old,,https://i.redd.it/m34l97ha0xve1.png
IndiaCricket,https://old.reddit.com/r/IndiaCricket/comments/1hcmizj/paddy_upton_the_man_behind_the_scenes/,4761,70,"PADDY UPTON, THE MAN BEHIND THE SCENES",,https://i.redd.it/vokn1qw9jf6e1.png
IndiaCricket,https://old.reddit.com/r/IndiaCricket/comments/1lguu9e/rishabhs_falling_paddle_sweep_is_not_accidental/,4754,314,Rishabh's falling paddle sweep is not accidental.,"Rishabh's falling paddle sweep is not accidental. It is intentional and extremely clever. Going down with the shot allows him to get under the ball and scoop it over leg slip with control.
Also noticed something interesting during Bashir’s spell. Shubman and Rishabh were speaking loudly in Hindi between deliveries. It wasn’t just casual talk. They were playing mind games with the bowler, trying to disrupt his rhythm. These minor details may not appear on the scoreboard, but they can have a significant impact on the game.",
IndiaCricket,https://old.reddit.com/r/IndiaCricket/comments/17uvmca/all_the_best_team_india/,4736,121,All the best team India,,
IndiaCricket,https://old.reddit.com/r/IndiaCricket/comments/15z3ktt/india_is_officially_on_the_moon/,4743,65,India is officially on the Moon,,
IndiaCricket,https://old.reddit.com/r/IndiaCricket/comments/1ds2g8w/can_someone_tell_me_how_much_each_player_will_get/,4704,511,Can someone tell me how much each player will get by dividing?,,https://i.redd.it/v25degj3wp9d1.png
IndiaCricket,https://old.reddit.com/r/IndiaCricket/comments/1lt7cjg/akashdeep_dedicates_his_performance_in_edgbaston/,4644,84,Akashdeep dedicates his performance in edgbaston test to his sister,Hope she gets well soon,"['https://preview.redd.it/vqj2bpjokabf1.png?width=108&crop=smart&auto=webp&s=411c29a2d8f5ebba8c3c9a359375a08beb066549', 'https://preview.redd.it/ywjqed4pkabf1.jpg?width=108&crop=smart&auto=webp&s=9ba409c1d734313250740828069bd899734cd300']"
IndiaCricket,https://old.reddit.com/r/IndiaCricket/comments/1iaiwam/jasprit_bumrah_at_the_coldplay_concert_ahmedabad/,4651,84,Jasprit Bumrah at the Coldplay concert Ahmedabad. So good to see Bumrah celebrated!!,,
IndiaCricket,https://old.reddit.com/r/IndiaCricket/comments/1dwhjxp/one_of_the_best_moment_of_world_cup/,4639,98,One of the best moment of world cup,,
IndiaCricket,https://old.reddit.com/r/IndiaCricket/comments/1kklio8/virat_kohli_retired_from_test_cricket/,4614,582,Virat Kohli retired from test cricket,,https://i.redd.it/ikvr5acnma0f1.jpeg
IndiaCricket,https://old.reddit.com/r/IndiaCricket/comments/1dxey5j/abhishek_sharma_100_in_t20is_against_zimbabwe/,4583,180,Abhishek Sharma 100* in T20Is against Zimbabwe,,
IndiaCricket,https://old.reddit.com/r/IndiaCricket/comments/1p76s1n/ms_dhoni_taking_the_blame_after_indias_series/,4582,189,"MS Dhoni taking the blame after India's series loss against Bangladesh in 2015, unlike a certain someone",,
IndiaCricket,https://old.reddit.com/r/IndiaCricket/comments/160oxsg/one_of_the_greatest_matches_of_indian_cricket_team/,4561,125,One of the greatest matches of Indian Cricket team.,,
IndiaCricket,https://old.reddit.com/r/IndiaCricket/comments/1o4r4ap/male_ego_ft_msd_vs_kaneria/,4549,97,Male Ego ft MSD vs Kaneria.,,
IndiaCricket,https://old.reddit.com/r/IndiaCricket/comments/17s08fd/rachin_ravindra_at_his_grandparents_home/,4546,201,Rachin Ravindra at his grandparent's home.,,
IndiaCricket,https://old.reddit.com/r/IndiaCricket/comments/1on5oxf/captain_harmanpreet_kaur_with_the_world_cup_trophy/,4535,113,Captain Harmanpreet Kaur with the World Cup Trophy.,,"['https://preview.redd.it/qy9kixt8xzyf1.jpg?width=108&crop=smart&auto=webp&s=2cbcd286bbdaeaeb0452ffde155ec25bf591a67a', 'https://preview.redd.it/qs8298r8xzyf1.jpg?width=108&crop=smart&auto=webp&s=ecdd88134e727df4e9f3ffdddbcea36c65c60fd1']"
IndiaCricket,https://old.reddit.com/r/IndiaCricket/comments/1hjc7u8/what_ashwin_actually_deserved/,4524,85,what Ashwin actually deserved,,
IndiaCricket,https://old.reddit.com/r/IndiaCricket/comments/1gzgzhs/rishabh_pant_instagram_story/,4488,55,Rishabh Pant instagram Story,,https://i.redd.it/n89ag8sfc13e1.png
IndiaCricket,https://old.reddit.com/r/IndiaCricket/comments/173irje/virat_kohli_wins_best_fielder_of_the_match_award/,4449,112,Virat Kohli wins best fielder of the match award in the dressing room,,
IndiaCricket,https://old.reddit.com/r/IndiaCricket/comments/19co41c/edged_and_taken/,4443,67,Edged and taken,,
IndiaCricket,https://old.reddit.com/r/IndiaCricket/comments/1iu1vi2/shikhar_dhawan_meeting_with_the_boys_after_a_long/,4425,96,Shikhar Dhawan Meeting With The Boys after a long time.,Beautiful video 😍 Everyone loves Gabbar....,
IndiaCricket,https://old.reddit.com/r/IndiaCricket/comments/17mzmz9/ek_hi_toh_dil_hai_shami_bhai_kitni_baar_jeetoge/,4414,98,"Ek hi toh dil hai Shami bhai, kitni baar jeetoge?",,
IndiaCricket,https://old.reddit.com/r/IndiaCricket/comments/1mha930/post_match_thread_india_beat_england_by_the/,4386,648,"[Post Match Thread]: India beat England by the barest of margins on Day 5 at The Oval, drawing the Anderson-Tendulkar Trophy, 2025.",,https://i.redd.it/ovhx17vhhzgf1.jpeg
IndiaCricket,https://old.reddit.com/r/IndiaCricket/comments/1mi8j64/sharing_my_thoughts_on_the_andersontendulkar/,4375,199,Sharing my thoughts on the Anderson–Tendulkar Trophy! Part 1,🏏,
IndiaCricket,https://old.reddit.com/r/IndiaCricket/comments/16wssvx/what_is_hope/,4316,92,what is hope?,,
IndiaCricket,https://old.reddit.com/r/IndiaCricket/comments/1i5hnad/child_got_his_bat_signed_by_rohit_sharma_but/,4281,190,"Child got his bat signed by Rohit Sharma, but forgot to fist bump him then...",,
IndiaCricket,https://old.reddit.com/r/IndiaCricket/comments/1icthr2/india_have_won_3_knockout_matches_in_my_lifetime/,4254,120,India have won 3 knockout matches in my lifetime against Australia and in all of them Yuvi was Man of the Match.,,
IndiaCricket,https://old.reddit.com/r/IndiaCricket/comments/16pv8kt/jadeja_mimicking_kohli/,4246,55,Jadeja mimicking Kohli,,
IndiaCricket,https://old.reddit.com/r/IndiaCricket/comments/1ipuwg1/is_this_how_ashwin_should_have_retired/,4228,92,Is this how Ashwin should have retired ?,,
IndiaCricket,https://old.reddit.com/r/IndiaCricket/comments/1dv8vci/things_you_love_to_see_rohit_snd_kohli_together/,4215,85,"Things you love to see, Rohit snd Kohli together lifting trophy",,
IndiaCricket,https://old.reddit.com/r/IndiaCricket/comments/1ie83qp/getting_bowled_off_an_incoming_ball_on_the/,4196,368,Getting bowled off an incoming ball on the drive...man,,
